{
  "flow_id": "user_n_n_nh_m_u_v_so_s_nh_tr_",
  "status": "reached_goal",
  "steps": [
    {
      "i": 1,
      "action": {
        "do": "goto",
        "target": null,
        "selector": null,
        "locator": null,
        "file": null,
        "url": "https://squoosh.app/",
        "text": null,
        "ms": null,
        "zoom": false
      },
      "locator": null,
      "target_text": null,
      "value": null,
      "url_before": null,
      "url_after": "https://squoosh.app/",
      "screenshot": "flow/steps/s1.jpg",
      "note": "Mở trang bắt đầu",
      "chapter_id": "c1",
      "t_ms_hint": 0
    },
    {
      "i": 2,
      "action": {
        "do": "click",
        "target": "2.8MB",
        "selector": null,
        "locator": null,
        "file": null,
        "url": null,
        "text": null,
        "ms": null,
        "zoom": false
      },
      "locator": {
        "role": "button",
        "name": "2.8MB",
        "text": "2.8MB",
        "css": "button",
        "nth": 2,
        "tag": "button",
        "fingerprint": "button|2.8mb|0.32,0.95",
        "bbox": {
          "x": 412.0,
          "y": 784.0,
          "w": 100.0,
          "h": 139.0
        }
      },
      "target_text": "2.8MB",
      "value": null,
      "url_before": "https://squoosh.app/",
      "url_after": "https://squoosh.app/editor",
      "screenshot": "flow/steps/s2.jpg",
      "note": "Bấm chọn ảnh mẫu 'Large photo 2.8MB' để nạp vào trình nén.",
      "chapter_id": "c1",
      "t_ms_hint": 2500
    },
    {
      "i": 3,
      "action": {
        "do": "type",
        "target": "Quality:",
        "selector": null,
        "locator": null,
        "file": null,
        "url": null,
        "text": "60",
        "ms": null,
        "zoom": false
      },
      "locator": {
        "role": "textbox",
        "name": "Quality:",
        "text": null,
        "css": "input",
        "nth": 3,
        "tag": "input",
        "fingerprint": "input||0.97,0.82",
        "bbox": {
          "x": 1376.0,
          "y": 728.0,
          "w": 54.0,
          "h": 23.0
        }
      },
      "target_text": "Quality:",
      "value": "60",
      "url_before": "https://squoosh.app/editor",
      "url_after": "https://squoosh.app/editor",
      "screenshot": "flow/steps/s3.jpg",
      "note": "Hạ chất lượng nén MozJPEG xuống 60 để giảm dung lượng ảnh tối đa.",
      "chapter_id": "c2",
      "t_ms_hint": 5000
    },
    {
      "i": 4,
      "action": {
        "do": "click",
        "target": "Download",
        "selector": null,
        "locator": null,
        "file": null,
        "url": null,
        "text": null,
        "ms": null,
        "zoom": false
      },
      "locator": {
        "role": "link",
        "name": "Download",
        "text": null,
        "css": "a",
        "nth": 1,
        "tag": "a",
        "fingerprint": "a||0.97,0.95",
        "bbox": {
          "x": 1347.0,
          "y": 807.0,
          "w": 93.0,
          "h": 93.0
        }
      },
      "target_text": "Download",
      "value": null,
      "url_before": "https://squoosh.app/editor",
      "url_after": "https://squoosh.app/editor",
      "screenshot": "flow/steps/s4.jpg",
      "note": "Bấm nút Download để lưu ảnh đã nén (587 kB, giảm từ 2.79 MB) về máy.",
      "chapter_id": "c3",
      "t_ms_hint": 7500
    },
    {
      "i": 5,
      "action": {
        "do": "click",
        "target": "Download",
        "selector": null,
        "locator": null,
        "file": null,
        "url": null,
        "text": null,
        "ms": null,
        "zoom": false
      },
      "locator": {
        "role": "link",
        "name": "Download",
        "text": null,
        "css": "a",
        "nth": 1,
        "tag": "a",
        "fingerprint": "a||0.97,0.95",
        "bbox": {
          "x": 1347.0,
          "y": 807.0,
          "w": 93.0,
          "h": 93.0
        }
      },
      "target_text": "Download",
      "value": null,
      "url_before": "https://squoosh.app/editor",
      "url_after": "https://squoosh.app/editor",
      "screenshot": "flow/steps/s5.jpg",
      "note": "Bấm nút Download để lưu ảnh đã nén (587 kB, giảm 79% so với 2.79 MB ban đầu) về máy.",
      "chapter_id": "c4",
      "t_ms_hint": 10000
    }
  ],
  "chapters": [
    {
      "id": "c1",
      "title": "Chọn ảnh mẫu",
      "step_ids": [
        1,
        2
      ],
      "value_line": null
    },
    {
      "id": "c2",
      "title": "Điều chỉnh cài đặt nén",
      "step_ids": [
        3
      ],
      "value_line": null
    },
    {
      "id": "c3",
      "title": "Lưu ảnh tối ưu",
      "step_ids": [
        4
      ],
      "value_line": null
    },
    {
      "id": "c4",
      "title": "Lưu ảnh đã tối ưu",
      "step_ids": [
        5
      ],
      "value_line": null
    }
  ],
  "sample_data": {
    "sample_image": "Large photo 2.8MB",
    "format": "MozJPEG",
    "quality": 60,
    "output_size": "587 kB",
    "reduction": "79%"
  },
  "warnings": [
    "Bắt đầu gửi kèm ảnh màn hình: trang có canvas/svg lớn.",
    "stop_before_submit «e15»: ref không phải nút gửi của form",
    "stop_before_submit «e15»: ref không phải nút gửi của form"
  ],
  "llm_calls": 7,
  "submit_policy": "stop",
  "stop_ref": null,
  "live": {
    "clip": "flow/live/flow.mp4",
    "logs": "flow/live/logs.json",
    "content_ms": 52334,
    "start_offset_ms": 5841,
    "sync_offset_ms": -1531,
    "pulse_at_ms": 1531,
    "segments": [
      {
        "from_ms": 5909,
        "to_ms": 7800,
        "kind": "llm_wait",
        "step": null,
        "note": ""
      },
      {
        "from_ms": 13126,
        "to_ms": 15884,
        "kind": "llm_wait",
        "step": null,
        "note": ""
      },
      {
        "from_ms": 20972,
        "to_ms": 24658,
        "kind": "llm_wait",
        "step": null,
        "note": ""
      },
      {
        "from_ms": 24658,
        "to_ms": 27304,
        "kind": "llm_wait",
        "step": null,
        "note": ""
      },
      {
        "from_ms": 27304,
        "to_ms": 31390,
        "kind": "llm_wait",
        "step": null,
        "note": ""
      },
      {
        "from_ms": 35076,
        "to_ms": 42609,
        "kind": "llm_wait",
        "step": null,
        "note": ""
      },
      {
        "from_ms": 46143,
        "to_ms": 52005,
        "kind": "llm_wait",
        "step": null,
        "note": ""
      }
    ],
    "marks": [
      {
        "i": 2,
        "start_ms": 7804,
        "end_ms": 12972
      },
      {
        "i": 3,
        "start_ms": 15886,
        "end_ms": 20906
      },
      {
        "i": 4,
        "start_ms": 31393,
        "end_ms": 35008
      },
      {
        "i": 5,
        "start_ms": 42612,
        "end_ms": 46064
      }
    ]
  },
  "give_up": null,
  "report": {
    "model": "deepseek-flash",
    "used_images": true,
    "llm_calls": 7,
    "prompt_tokens": 19993,
    "completion_tokens": 3819,
    "seconds": 57.4,
    "write_requests": [],
    "text_calls": 0,
    "vision_calls": 7,
    "escalated_because": "trang có canvas/svg lớn",
    "invented_refs": 0,
    "repeat_warnings": 2
  }
}