{
  "flow_id": "user_l_n_danh_s_ch_vi_c_trong",
  "status": "reached_goal",
  "steps": [
    {
      "i": 1,
      "action": {
        "do": "goto",
        "target": null,
        "selector": null,
        "locator": null,
        "file": null,
        "url": "https://todomvc.com/examples/react/dist/",
        "text": null,
        "ms": null,
        "zoom": false
      },
      "locator": null,
      "target_text": null,
      "value": null,
      "url_before": null,
      "url_after": "https://todomvc.com/examples/react/dist/",
      "screenshot": "flow/steps/s1.jpg",
      "note": "Mở trang bắt đầu",
      "chapter_id": "c1",
      "t_ms_hint": 0
    },
    {
      "i": 2,
      "action": {
        "do": "type",
        "target": "New Todo Input",
        "selector": null,
        "locator": null,
        "file": null,
        "url": null,
        "text": "Mua sữa tươi\n",
        "ms": null,
        "zoom": false
      },
      "locator": {
        "role": "textbox",
        "name": "New Todo Input",
        "text": null,
        "css": "[data-testid=\"text-input\"]",
        "nth": null,
        "tag": "input",
        "fingerprint": "input||0.60,0.18",
        "bbox": {
          "x": 595.0,
          "y": 130.0,
          "w": 550.0,
          "h": 65.0
        }
      },
      "target_text": "New Todo Input",
      "value": "Mua sữa tươi\n",
      "url_before": "https://todomvc.com/examples/react/dist/",
      "url_after": "https://todomvc.com/examples/react/dist/",
      "screenshot": "flow/steps/s2.jpg",
      "note": "Gõ việc đầu tiên vào ô nhập và nhấn Enter để thêm vào danh sách.",
      "chapter_id": "c1",
      "t_ms_hint": 2500
    },
    {
      "i": 3,
      "action": {
        "do": "type",
        "target": "New Todo Input",
        "selector": null,
        "locator": null,
        "file": null,
        "url": null,
        "text": "Gọi điện cho khách hàng",
        "ms": null,
        "zoom": false
      },
      "locator": {
        "role": "textbox",
        "name": "New Todo Input",
        "text": null,
        "css": "[data-testid=\"text-input\"]",
        "nth": null,
        "tag": "input",
        "fingerprint": "input||0.60,0.18",
        "bbox": {
          "x": 595.0,
          "y": 130.0,
          "w": 550.0,
          "h": 65.0
        }
      },
      "target_text": "New Todo Input",
      "value": "Gọi điện cho khách hàng",
      "url_before": "https://todomvc.com/examples/react/dist/",
      "url_after": "https://todomvc.com/examples/react/dist/",
      "screenshot": "flow/steps/s3.jpg",
      "note": "Gõ việc thứ hai vào ô nhập và nhấn Enter để thêm vào danh sách.",
      "chapter_id": "c2",
      "t_ms_hint": 5000
    },
    {
      "i": 4,
      "action": {
        "do": "type",
        "target": "New Todo Input",
        "selector": null,
        "locator": null,
        "file": null,
        "url": null,
        "text": "Viết báo cáo tuần",
        "ms": null,
        "zoom": false
      },
      "locator": {
        "role": "textbox",
        "name": "New Todo Input",
        "text": null,
        "css": "[data-testid=\"text-input\"]",
        "nth": null,
        "tag": "input",
        "fingerprint": "input||0.60,0.18",
        "bbox": {
          "x": 595.0,
          "y": 130.0,
          "w": 550.0,
          "h": 65.0
        }
      },
      "target_text": "New Todo Input",
      "value": "Viết báo cáo tuần",
      "url_before": "https://todomvc.com/examples/react/dist/",
      "url_after": "https://todomvc.com/examples/react/dist/",
      "screenshot": "flow/steps/s4.jpg",
      "note": "Gõ việc thứ ba 'Viết báo cáo tuần' vào ô nhập.",
      "chapter_id": "c2",
      "t_ms_hint": 7500
    },
    {
      "i": 5,
      "action": {
        "do": "check",
        "target": "Mua sữa tươi",
        "selector": null,
        "locator": null,
        "file": null,
        "url": null,
        "text": null,
        "ms": null,
        "zoom": false
      },
      "locator": {
        "role": "checkbox",
        "name": "Mua sữa tươi",
        "text": null,
        "css": "main input",
        "nth": 1,
        "tag": "input",
        "fingerprint": "input||0.43,0.25",
        "bbox": {
          "x": 595.0,
          "y": 205.0,
          "w": 40.0,
          "h": 40.0
        }
      },
      "target_text": "Mua sữa tươi",
      "value": null,
      "url_before": "https://todomvc.com/examples/react/dist/",
      "url_after": "https://todomvc.com/examples/react/dist/",
      "screenshot": "flow/steps/s5.jpg",
      "note": "Tích vào ô đánh dấu của việc 'Mua sữa tươi' để đánh dấu đã xong.",
      "chapter_id": "c3",
      "t_ms_hint": 10000
    },
    {
      "i": 6,
      "action": {
        "do": "click",
        "target": "Active",
        "selector": null,
        "locator": null,
        "file": null,
        "url": null,
        "text": null,
        "ms": null,
        "zoom": false
      },
      "locator": {
        "role": "link",
        "name": "Active",
        "text": "Active",
        "css": "footer a",
        "nth": 3,
        "tag": "a",
        "fingerprint": "a|active|0.58,0.44",
        "bbox": {
          "x": 814.0,
          "y": 382.0,
          "w": 57.0,
          "h": 25.0
        }
      },
      "target_text": "Active",
      "value": null,
      "url_before": "https://todomvc.com/examples/react/dist/",
      "url_after": "https://todomvc.com/examples/react/dist/#/active",
      "screenshot": "flow/steps/s6.jpg",
      "note": "Nhấn bộ lọc Active để chỉ hiển thị các việc chưa hoàn thành.",
      "chapter_id": "c4",
      "t_ms_hint": 12500
    }
  ],
  "chapters": [
    {
      "id": "c1",
      "title": "Thêm việc đầu tiên",
      "step_ids": [
        1,
        2
      ],
      "value_line": null
    },
    {
      "id": "c2",
      "title": "Thêm việc thứ hai",
      "step_ids": [
        3,
        4
      ],
      "value_line": null
    },
    {
      "id": "c3",
      "title": "Đánh dấu hoàn thành",
      "step_ids": [
        5
      ],
      "value_line": null
    },
    {
      "id": "c4",
      "title": "Lọc việc còn lại",
      "step_ids": [
        6
      ],
      "value_line": null
    }
  ],
  "sample_data": {
    "todo1": "Mua sữa tươi",
    "todo2": "Gọi điện cho khách hàng",
    "todo3": "Viết báo cáo tuần"
  },
  "warnings": [],
  "llm_calls": 6,
  "submit_policy": "stop",
  "stop_ref": null,
  "report": {
    "model": "deepseek-flash",
    "used_images": true,
    "llm_calls": 6,
    "prompt_tokens": 14847,
    "completion_tokens": 1032,
    "seconds": 19.6,
    "write_requests": [],
    "invented_refs": 0,
    "repeat_warnings": 0
  }
}