{
  "flow_id": "user_th_m_nh_n_vi_n_m_i_v_o_h",
  "status": "stopped_before_submit",
  "steps": [
    {
      "i": 1,
      "action": {
        "do": "goto",
        "target": null,
        "selector": null,
        "locator": null,
        "file": null,
        "url": "https://opensource-demo.orangehrmlive.com/web/index.php/pim/viewEmployeeList",
        "text": null,
        "ms": null,
        "zoom": false
      },
      "locator": null,
      "target_text": null,
      "value": null,
      "url_before": null,
      "url_after": "https://opensource-demo.orangehrmlive.com/web/index.php/pim/viewEmployeeList",
      "screenshot": "flow/steps/s1.jpg",
      "note": "Mở trang bắt đầu",
      "chapter_id": "c1",
      "t_ms_hint": 0
    },
    {
      "i": 2,
      "action": {
        "do": "click",
        "target": "Add",
        "selector": null,
        "locator": null,
        "file": null,
        "url": null,
        "text": null,
        "ms": null,
        "zoom": false
      },
      "locator": {
        "role": "button",
        "name": "Add",
        "text": "Add",
        "css": "button",
        "nth": 6,
        "tag": "button",
        "fingerprint": "button|add|0.27,0.15",
        "bbox": {
          "x": 329.0,
          "y": 506.0,
          "w": 109.0,
          "h": 31.0
        }
      },
      "target_text": "Add",
      "value": null,
      "url_before": "https://opensource-demo.orangehrmlive.com/web/index.php/pim/viewEmployeeList",
      "url_after": "https://opensource-demo.orangehrmlive.com/web/index.php/pim/addEmployee",
      "screenshot": "flow/steps/s2.jpg",
      "note": "Bấm nút Add để mở luồng tạo hồ sơ nhân viên mới",
      "chapter_id": "c1",
      "t_ms_hint": 2500
    },
    {
      "i": 3,
      "action": {
        "do": "type",
        "target": "Employee Full Name",
        "selector": null,
        "locator": null,
        "file": null,
        "url": null,
        "text": "An",
        "ms": null,
        "zoom": false
      },
      "locator": {
        "role": "textbox",
        "name": "Employee Full Name",
        "text": null,
        "css": "input",
        "nth": 2,
        "tag": "input",
        "fingerprint": "input||0.51,0.27",
        "bbox": {
          "x": 615.0,
          "y": 249.0,
          "w": 250.0,
          "h": 45.0
        }
      },
      "target_text": "Employee Full Name",
      "value": "An",
      "url_before": "https://opensource-demo.orangehrmlive.com/web/index.php/pim/addEmployee",
      "url_after": "https://opensource-demo.orangehrmlive.com/web/index.php/pim/addEmployee",
      "screenshot": "flow/steps/s3.jpg",
      "note": "Nhập tên (First Name) của nhân viên mới.",
      "chapter_id": "c2",
      "t_ms_hint": 5000
    },
    {
      "i": 4,
      "action": {
        "do": "type",
        "target": "Employee Full Name",
        "selector": null,
        "locator": null,
        "file": null,
        "url": null,
        "text": "Văn",
        "ms": null,
        "zoom": false
      },
      "locator": {
        "role": "textbox",
        "name": "Employee Full Name",
        "text": null,
        "css": "input",
        "nth": 3,
        "tag": "input",
        "fingerprint": "input||0.69,0.27",
        "bbox": {
          "x": 865.0,
          "y": 249.0,
          "w": 250.0,
          "h": 45.0
        }
      },
      "target_text": "Employee Full Name",
      "value": "Văn",
      "url_before": "https://opensource-demo.orangehrmlive.com/web/index.php/pim/addEmployee",
      "url_after": "https://opensource-demo.orangehrmlive.com/web/index.php/pim/addEmployee",
      "screenshot": "flow/steps/s4.jpg",
      "note": "Nhập tên đệm Văn vào ô Middle Name.",
      "chapter_id": "c2",
      "t_ms_hint": 7500
    },
    {
      "i": 5,
      "action": {
        "do": "type",
        "target": "Employee Full Name",
        "selector": null,
        "locator": null,
        "file": null,
        "url": null,
        "text": "Nguyễn",
        "ms": null,
        "zoom": false
      },
      "locator": {
        "role": "textbox",
        "name": "Employee Full Name",
        "text": null,
        "css": "input",
        "nth": 4,
        "tag": "input",
        "fingerprint": "input||0.86,0.27",
        "bbox": {
          "x": 1115.0,
          "y": 249.0,
          "w": 250.0,
          "h": 45.0
        }
      },
      "target_text": "Employee Full Name",
      "value": "Nguyễn",
      "url_before": "https://opensource-demo.orangehrmlive.com/web/index.php/pim/addEmployee",
      "url_after": "https://opensource-demo.orangehrmlive.com/web/index.php/pim/addEmployee",
      "screenshot": "flow/steps/s5.jpg",
      "note": "Nhập họ của nhân viên vào ô Last Name.",
      "chapter_id": "c2",
      "t_ms_hint": 10000
    },
    {
      "i": 6,
      "action": {
        "do": "hover",
        "target": "Save",
        "selector": null,
        "locator": null,
        "file": null,
        "url": null,
        "text": null,
        "ms": null,
        "zoom": false
      },
      "locator": {
        "role": "button",
        "name": "Save",
        "text": "Save",
        "css": "button",
        "nth": 5,
        "tag": "button",
        "fingerprint": "button|save|0.91,0.49",
        "bbox": {
          "x": 1267.0,
          "y": 477.0,
          "w": 100.0,
          "h": 32.0
        }
      },
      "target_text": "Save",
      "value": null,
      "url_before": "https://opensource-demo.orangehrmlive.com/web/index.php/pim/addEmployee",
      "url_after": "https://opensource-demo.orangehrmlive.com/web/index.php/pim/addEmployee",
      "screenshot": "flow/steps/s6.jpg",
      "note": "Form đã điền đầy đủ họ tên và mã nhân viên, dừng lại trước nút Save để chưa tạo hồ sơ",
      "chapter_id": "c3",
      "t_ms_hint": 12500
    },
    {
      "i": 7,
      "action": {
        "do": "highlight",
        "target": "Save",
        "selector": null,
        "locator": null,
        "file": null,
        "url": null,
        "text": null,
        "ms": 1800,
        "zoom": false
      },
      "locator": {
        "role": "button",
        "name": "Save",
        "text": "Save",
        "css": "button",
        "nth": 5,
        "tag": "button",
        "fingerprint": "button|save|0.91,0.49",
        "bbox": {
          "x": 1267.0,
          "y": 477.0,
          "w": 100.0,
          "h": 32.0
        }
      },
      "target_text": "Save",
      "value": null,
      "url_before": "https://opensource-demo.orangehrmlive.com/web/index.php/pim/addEmployee",
      "url_after": "https://opensource-demo.orangehrmlive.com/web/index.php/pim/addEmployee",
      "screenshot": "flow/steps/s7.jpg",
      "note": "Form đã điền đầy đủ họ tên và mã nhân viên, dừng lại trước nút Save để chưa tạo hồ sơ",
      "chapter_id": "c3",
      "t_ms_hint": 15000
    }
  ],
  "chapters": [
    {
      "id": "c1",
      "title": "Mở form",
      "step_ids": [
        1,
        2
      ],
      "value_line": null
    },
    {
      "id": "c2",
      "title": "Điền thông tin",
      "step_ids": [
        3,
        4,
        5
      ],
      "value_line": null
    },
    {
      "id": "c3",
      "title": "Kiểm tra và dừng trước khi lưu",
      "step_ids": [
        6,
        7
      ],
      "value_line": null
    }
  ],
  "sample_data": {
    "firstName": "An",
    "middleName": "Văn",
    "lastName": "Nguyễn",
    "employeeId": "0443"
  },
  "warnings": [],
  "llm_calls": 5,
  "submit_policy": "stop",
  "stop_ref": "Save",
  "live": {
    "clip": "flow/live/flow.mp4",
    "logs": "flow/live/logs.json",
    "content_ms": 43365,
    "start_offset_ms": 8223,
    "sync_offset_ms": -1224,
    "pulse_at_ms": 1224,
    "segments": [
      {
        "from_ms": 8331,
        "to_ms": 9619,
        "kind": "llm_wait",
        "step": null,
        "note": ""
      },
      {
        "from_ms": 17459,
        "to_ms": 18858,
        "kind": "llm_wait",
        "step": null,
        "note": ""
      },
      {
        "from_ms": 23300,
        "to_ms": 24172,
        "kind": "llm_wait",
        "step": null,
        "note": ""
      },
      {
        "from_ms": 28535,
        "to_ms": 29481,
        "kind": "llm_wait",
        "step": null,
        "note": ""
      },
      {
        "from_ms": 34344,
        "to_ms": 35418,
        "kind": "llm_wait",
        "step": null,
        "note": ""
      }
    ],
    "marks": [
      {
        "i": 2,
        "start_ms": 9632,
        "end_ms": 17373
      },
      {
        "i": 3,
        "start_ms": 18862,
        "end_ms": 23207
      },
      {
        "i": 4,
        "start_ms": 24203,
        "end_ms": 28441
      },
      {
        "i": 5,
        "start_ms": 29489,
        "end_ms": 34248
      },
      {
        "i": 6,
        "start_ms": 35438,
        "end_ms": 40378
      },
      {
        "i": 7,
        "start_ms": 40379,
        "end_ms": 42893
      }
    ]
  },
  "give_up": null,
  "report": {
    "model": "deepseek-chat",
    "used_images": false,
    "llm_calls": 5,
    "prompt_tokens": 11548,
    "completion_tokens": 407,
    "seconds": 53.9,
    "write_requests": [],
    "text_calls": 5,
    "vision_calls": 0,
    "escalated_because": null,
    "invented_refs": 0,
    "repeat_warnings": 0
  }
}